Type	Period	Title	ShortDescription	FundingInstitution	Program	ProjectType	WebUrl	Logo	ProjectCode	ProjectStatus	ProjectCategory	RelatedResearchAreas	TimeCreated	TimeUpdated	People	CollabEntitites	Institutions	Keywords	Description
Project	09/2005 - 09/2009	ENSEMBLES	Ensemble prediction system for seasonal forecast and regional climate change based on the principal state-of-the-art, global and regional models developed in Europe	European Union	6th European FP	European project	http://www.ensembles-eu.org		GOCE-CT-2003-505539	Finished	Regular project		4 Apr 2008 - 19:17	11 Oct 2012 - 11:58	Gutiérrez, J.M. | Cofiño, A.S. | San-Martín, D. | Sordo, C.M. | Frías, M.D. | Fernández, J. | Herrera, S. | Pons, M.R. | Ancell, R.	AEMET Modelización | Electricite de France (EDF)	UC	Regional climate scenarios | Probabilistic forecast | Ensemble Prediction | Climate simulation | Climate change | Seasonal prediction	
Project	02/2005 - 06/2010	COST Action 731	Propagation of uncertainty in advanced meteo-hydrological forecast systems	European Science Foundation	6th European FP	European project	http://cost731.bafg.de		COST731	In progress	Research network		16 Jun 2008 - 08:33	18 Dec 2008 - 17:44	Cofiño, A.S. | Orfila, B.			Statistical downscaling	
Project	10/2004 - 09/2007	SEASONAL	Economic Value and Predictability of Seasonal Ensemble Forecast Models in Middle and Tropical Latitudes.	Spanish Goverment	Spanish R+D Program 2004-2007	National project			CGL2004-02652/CLI	Finished	Regular project		8 Jul 2008 - 17:46	26 Jan 2010 - 01:31	Rodríguez, M.A. | Gutiérrez, J.M. | Ancell, R. | Díez, E. | Wio, H. | Primo, C. | Frías, M.D.	SENAMHI | AEMET Modelización	IFCA | UC | AEMET	Logarithmic bred vectors | Space-time chaos | El Niño | Statistical downscaling | DEMETER | Seasonal prediction	
Project	11/2003 - 11/2005	Regional statistical downscaling for seasonal prediction, using Self Organizing Maps	Regional statistical downscaling for seasonal prediction, using Self Organizing Maps.		AEMET projects	National project	http://www.boe.es/boe/dias/2004/05/24/pdfs/A19371-19371.pdf			Finished	Regular project		7 Jul 2008 - 11:03	18 Dec 2008 - 17:45	Ancell, R. | Sordo, C.M.		AEMET	Self-Organizing Maps | Seasonal prediction | Statistical downscaling	
Project	01/2003	Red Ibérica MM5	Thematic network in the Iberian peninsula for research and development of projects based on regional MM5/WRF atmospheric model		Spanish R+D Program 2004-2007	National project	http://redibericamm5.uib.es			In progress	Research network		2 Jul 2008 - 16:45	18 Dec 2008 - 17:43	Fernández, J. | Cofiño, A.S. | Gutiérrez, J.M. | Rodríguez, M.A.		UC	Climate simulation | WRF model | MM5 model	
Project	03/2002 - 04/2005	CrossGrid	CrossGrid		5th European FP	European project	http://www.crossgrid.org			Finished	Regular project		22 Sep 2008 - 16:01	4 Nov 2009 - 00:42	Gutiérrez, J.M. | Cofiño, A.S. | Sordo, C.M.		UC	eScience | GRID computing	
Project	02/2002 - 10/2003	Statistical downscaling techniques for different forecast ranges	Research on statistical downscaling techniques for different forecast ranges		AEMET projects	National project	http://www.boe.es/boe/dias/2002/05/04/pdfs/A16390-16391.pdf			Finished	Regular project		7 Jul 2008 - 11:10	30 Jun 2009 - 10:07	Ancell, R. | Primo, C.		AEMET	Seasonal prediction | Statistical downscaling	
Project	04/2000 - 09/2003	DEMETER	Development of a European Multimodel Ensemble system for seasonal to inTERannual prediction	European Union	5th European FP	European project	http://www.ecmwf.int/research/demeter/			Finished	Regular project		29 May 2008 - 02:11	4 Nov 2009 - 00:44	Gutiérrez, J.M. | Cofiño, A.S. | Sordo, C.M. | Ancell, R. | Rodríguez, M.A.	AEMET Modelización		Statistical downscaling | Ensemble Prediction | Seasonal prediction | DEMETER	